{
  "contract": "ai-sow-final-review-v1",
  "runId": "run-000001-000001",
  "inputRevisionId": "000001",
  "scopeSha256": "161ae56b67e7712cbaebc3fc4758b85033273c726295482a1544a7e3568505ee",
  "deliverySha256": "9b005c082976d2b9274ea0cb8890b68cbab893a3bb14349e79840a94e1329f94",
  "packetSha256": "2222222222222222222222222222222222222222222222222222222222222222",
  "decision": "PASS",
  "notes": [],
  "questions": []
}
